{
  "moduleType": "cvs-module",
  "schemaVersion": "1.0.0",
  "packId": "retail",
  "moduleId": "02_enterprise",
  "payload": {
    "nodes": [
      {
        "id": "b1",
        "type": "board",
        "title": "Grow profitable same-store sales",
        "summary": "Improve conversion and fulfilment without adding unnecessary labour",
        "icon": "target",
        "evidenceStatus": "illustrative",
        "confidence": "to-validate"
      },
      {
        "id": "b2",
        "type": "board",
        "title": "Reduce store cost to serve",
        "summary": "Protect availability and optimise energy/refrigeration spend",
        "icon": "target",
        "evidenceStatus": "illustrative",
        "confidence": "to-validate"
      },
      {
        "id": "b3",
        "type": "board",
        "title": "Protect reputation and stock",
        "summary": "Improve safety, loss prevention and cold-chain assurance",
        "icon": "target",
        "evidenceStatus": "illustrative",
        "confidence": "to-validate"
      },
      {
        "id": "f1",
        "type": "function",
        "title": "Chief commercial officer",
        "summary": "Accountable decision maker in this value stream.",
        "icon": "users",
        "evidenceStatus": "illustrative",
        "confidence": "to-validate"
      },
      {
        "id": "f2",
        "type": "function",
        "title": "Store operations",
        "summary": "Accountable decision maker in this value stream.",
        "icon": "users",
        "evidenceStatus": "illustrative",
        "confidence": "to-validate"
      },
      {
        "id": "f3",
        "type": "function",
        "title": "Merchandising",
        "summary": "Accountable decision maker in this value stream.",
        "icon": "users",
        "evidenceStatus": "illustrative",
        "confidence": "to-validate"
      },
      {
        "id": "f4",
        "type": "function",
        "title": "Facilities / Energy",
        "summary": "Accountable decision maker in this value stream.",
        "icon": "users",
        "evidenceStatus": "illustrative",
        "confidence": "to-validate"
      },
      {
        "id": "f5",
        "type": "function",
        "title": "Loss prevention / IT",
        "summary": "Accountable decision maker in this value stream.",
        "icon": "users",
        "evidenceStatus": "illustrative",
        "confidence": "to-validate"
      },
      {
        "id": "v1",
        "type": "stream",
        "title": "Grow",
        "summary": "Increase revenue or capacity",
        "icon": "layers",
        "evidenceStatus": "illustrative",
        "confidence": "to-validate"
      },
      {
        "id": "v2",
        "type": "stream",
        "title": "Optimise",
        "summary": "Improve asset and resource efficiency",
        "icon": "layers",
        "evidenceStatus": "illustrative",
        "confidence": "to-validate"
      },
      {
        "id": "v3",
        "type": "stream",
        "title": "Protect",
        "summary": "Mitigate financial, operational and cyber risk",
        "icon": "layers",
        "evidenceStatus": "illustrative",
        "confidence": "to-validate"
      },
      {
        "id": "v4",
        "type": "stream",
        "title": "Operate",
        "summary": "Continuously run and improve service",
        "icon": "layers",
        "evidenceStatus": "illustrative",
        "confidence": "to-validate"
      },
      {
        "id": "v5",
        "type": "stream",
        "title": "Govern",
        "summary": "Accountability, evidence, controls and policy",
        "icon": "layers",
        "evidenceStatus": "illustrative",
        "confidence": "to-validate"
      },
      {
        "id": "v6",
        "type": "stream",
        "title": "Realise",
        "summary": "Prove measured, attributable outcomes",
        "icon": "layers",
        "evidenceStatus": "illustrative",
        "confidence": "to-validate"
      }
    ]
  }
}